Symbol,Name
KJUN,Innovator US Small Cap Power Buffer ETF - June
WINC,Western Asset Short Duration Income ETF
AGNG,Global X Aging Population ETF
TAIL,Cambria Tail Risk ETF
IOCT,Innovator Intl Developed Power Buffer ETF - Oct
WLTG,WealthTrust DBS Long Term Growth ETF
GAUG,FT Vest US Equity Moderate Buffer ETF - Aug
ENZL,Ishares Msci New Zealand Etf
QLVE,FlexShares EmMkts Quality Low Volatility Idx Fd
SPDV,Aam S&P 500 High Dividend Value ETF
TOK,iShares MSCI Kokusai ETF
GXG,Global X MSCI Colombia ETF
HDMV,First Trust Horizon Managed Vol Dev Intl ETF
MGOV,First Trust Intermediate Government Oppty ETF
DWUS,AdvisorShares Dorsey Wright FSM US Core ETF
IPKW,Invesco International BuyBack Achievers ETF
BELT,BlackRock Long-Term US Equity ETF
IAUF,iShares Gold Strategy ETF
QLC,FlexShares US Quality Large Cap Index Fund
MFUL,Mindful Conservative ETF
EEMD,Aam S&P Emerging Markets High Dividend Value ETF
MOTO,SmartETFs Smart Transportation & Technology ETF
SIXH,ETC 6 Meridian Hedged Equity-Index Option Strt ETF
FSCS,First Trust SMID Capital Strength ETF
SMRI,Bushido Capital US Equity ETF
HEEM,iShares Currency Hedged MSCI Emerging Markets ETF
LEXI,Alexis Practical Tactical ETF
GABF,Gabelli Financial Services Opportunities ETF
RSPC,Invesco S&P 500 Equal Weight Communication Svc ETF
DUKZ,Ocean Park Diversified Income ETF
FTXG,First Trust Nasdaq Food & Beverage ETF
EFO,ProShares Ultra MSCI EAFE
QDEF,FlexShares Quality Dividend Defensive Index Fund
SQEW,LeaderShares Equity Skew ETF
HFND,Unlimited HFND Multi-Strategy Return Tracker ETF
FTAG,First Trust Indxx Global Agriculture ETF
PY,Principal Value ETF
GGRW,Gabelli Growth Innovators ETF
BSTP,Innovator Buffer Step-Up Strategy ETF
RYSE,Vest 10 Year Interest Rate Hedge ETF
BITC,Bitwise Bitcoin Strategy Optimum Roll ETF
FDCE,Foundations Dynamic Core ETF
ITDF,iShares LifePath Target Date 2050 ETF
XOCT,FT Vest US Equity Enh & Mod Buffer ETF - Oct
FTDS,First Trust Dividend Strength ETF
KVLE,KraneShares Value Line Dynamic Dividend Eq Ix ETF
FTRB,Federated Hermes Total Return Bond ETF
KROP,Global X AgTech & Food Innovation ETF
NIKL,Sprott Nickel Miners ETF
INRO,BlackRock US Industry Rotation ETF
RFDA,RiverFront Dynamic US Dividend Advantage ETF
XSEP,FT Vest US Equity Enh & Mod Buffer ETF - Sept
ITDG,iShares LifePath Target Date 2055 ETF
ITDC,iShares LifePath Target Date 2035 ETF
GOCT,FT Vest US Equity Moderate Buffer ETF - Oct
AVEE,Avantis Emerging Markets Small Cap Equity ETF
FYEE,Fidelity Yield Enhanced Equity ETF
QIG,WisdomTree US Corporate Bond Fund
PEX,ProShares Global Listed Private Equity ETF
ITDH,iShares LifePath Target Date 2060 ETF
AGMI,Themes Silver Miners ETF
BKF,iShares MSCI BIC ETF
NTSE,WisdomTree Emerging Markets Efficient Core Fund
AVNM,Avantis All International Markets Equity ETF
PHEQ,Parametric Hedged Equity ETF
KOOL,North Shore Equity Rotation ETF
EMCB,WisdomTree Emerging Markets Corporate Bond Fund
PYZ,Invesco Dorsey Wright Basic Materials Momentum ETF
SPBC,Simplify US Equity PLUS GBTC ETF
TRND,Pacer Trendpilot Fund of Funds ETF
RFDI,First Trust RiverFront Dynamic Developed Intl ETF
KEMQ,KraneShares Emerging Markets Consumer Tech Idx ETF
LQDI,iShares Inflation Hedged Corporate Bond ETF
UXI,ProShares Ultra Industrials
JHPI,John Hancock Preferred Income ETF
CVSB,Calvert Ultra-Short Investment Grade ETF
DMAT,Global X Disruptive Materials ETF
TFJL,Innovator 20+ Year Treasury Bond 5 Floor ETF - Qtr
EGUS,iShares ESG Aware MSCI USA Growth ETF
GXTG,Global X Thematic Growth ETF
GDMA,Gadsden Dynamic Multi-Asset ETF
ZIG,Acquirers Fund
HIDV,AB US High Dividend ETF
EMC,Global X Emerging Markets Great Consumer ETF
BAMV,Brookstone Value Stock ETF
HCOW,Amplify Cash Flow High Income ETF
RNRG,Global X Renewable Energy Producers ETF
DDIV,First Trust Dorsey Wright Momentum & Dividend ETF
EAPR,Innovator Emerging Markets Power Buffer ETF - Apr
SBND,Columbia Short Duration Bond ETF
FIAX,Nicholas Fixed Income Alternative ETF
FEBW,AllianzIM US Large Cap Buffer20 Feb ETF
PSL,Invesco Dorsey Wright Consumer Staples Mo ETF
FLSP,Franklin Systematic Style Premia ETF
PWS,Pacer WealthShield ETF
KHYB,KraneShares Asia Pacific High Income Bond ETF
OASC,OneAscent Small Cap Core ETF
GBUY,Goldman Sachs Future Consumer Equity ETF
PJFG,PGIM Jennison Focused Growth ETF
MEMX,Matthews Emerging Markets ex China Active ETF
IBIF,iShares iBonds Oct 2029 Term TIPS ETF
DALI,First Trust Dorsey Wright DALI 1 ETF
FOVL,iShares Focused Value Factor ETF
ISRA,VanEck Israel ETF
QDIV,Global X S&P 500 Quality Dividend ETF
SPVM,Invesco S and P 500 Value with Momentum ETF
SATO,Invesco Alerian Galaxy Crypto Economy ETF
NBOS,Neuberger Berman Option Strategy ETF
EFAD,ProShares MSCI EAFE Dividend Growers ETF
WBIY,WBI Power Factor High Dividend ETF
BNGE,First Trust S-Network Streaming & Gaming ETF
APMU,ActivePassive Intermediate Municipal Bond ETF
CGGE,Capital Group Global Equity ETF
BTCZ,T-Rex 2X Inverse Bitcoin Daily Target ETF
BSCY,Invesco BulletShares 2034 Corporate Bond ETF
AVXC,Avantis Emerging Markets ex-China Equity ETF
LCR,Leuthold Core ETF
TYO,Direxion Daily 7-10 Year Treasury Bear 3X Shares
BKCI,BNY Mellon Concentrated International ETF
AGRH,iShares Interest Rate Hedged US Aggregate Bond ETF
THLV,THOR Low Volatility ETF
IBAT,iShares Energy Storage & Materials ETF
IBOT,VanEck Robotics ETF
SPXT,ProShares S&P 500 Ex-Technology ETF
JCPI,JPMorgan Inflation Managed Bond ETF
BBP,Virtus LifeSci Biotech Products ETF
CZA,Invesco Zacks Mid-Cap ETF
XTJL,Innovator US Equity Accelerated Plus ETF - July
SAMT,Strategas Macro Thematic Opportunities ETF
CRIT,Optica Rare Earths & Critical Materials ETF
USNZ,Xtrackers Net Zero Pathway Paris Aligned US Eq ETF
LQDB,iShares BBB Rated Corporate Bond ETF
NUDV,Nuveen ESG Dividend ETF
AIVI,WisdomTree International AI Enhanced Value Fund
LALT,First Trust Multi-Strategy Alternative ETF
XIDE,FT Vest US Eqty Buff & Prem Inc ETF - Dec
MVFG,Monarch Volume Factor Global Unconstrained Idx ETF
QEMM,SPDR MSCI Emerging Markets StrategicFactors ETF
DINT,Davis Select International ETF
AHYB,American Century Select High Yield ETF
HOMZ,Hoya Capital Housing ETF
NURE,Nuveen Short-Term REIT ETF
UOCT,Innovator US Equity Ultra Buffer ETF - October
BTEK,BlackRock Future Tech ETF
VCAR,Simplify Volt RoboCar Disruption and Tech ETF
ABCS,Alpha Blue Capital US Small-Mid Cap Dynamic ETF
CNXT,VanEck ChiNext ETF
EEMX,SPDR MSCI Emerg Mkts Fossil Fuel Reserves Free ETF
ISWN,Amplify BlackSwan ISWN ETF
BJK,VanEck Gaming ETF
IQSU,IQ Candriam US Large Cap Equity ETF
ISVL,iShares Intl Developed Small Cap Value Factor ETF
SEA,US Global Sea to Sky Cargo ETF
IWLG,IQ Winslow Large Cap Growth ETF
HAPI,Harbor Human Capital Factor US Large Cap ETF
FDAT,Tactical Advantage ETF
ILIT,iShares Lithium Miners and Producers ETF
GAMR,Amplify Video Game Tech ETF
QPX,AdvisorShares Q Dynamic Growth ETF
KLNE,Direxion Daily Global Clean Energy Bull 2X Shares
CVAR,Cultivar ETF
IBIG,iShares iBonds Oct 2030 Term TIPS ETF
ARKA,ARK 21Shares Active Bitcoin Futures Strategy ETF
OILT,Texas Capital Texas Oil Index ETF
GERM,Amplify Treatments Testing And Advancements ETF
KLDW,Knowledge Leaders Developed World ETF
WLDR,Affinity World Leaders Equity ETF
GSPY,Gotham Enhanced 500 ETF
AZTD,Aztlan Global Stock Selection DM SMID ETF
SHDG,Soundwatch Hedged Equity ETF
PSCJ,Pacer Swan SOS Conservative (July) ETF
EMFQ,Amplify Emerging Markets FinTech ETF
MAYW,AllianzIM US Large Cap Buffer20 May ETF
TGLR,LAFFER TENGLER Equity Income ETF
AMZP,Kurv Yield Premium Strategy Amazon AMZN ETF
SPQ,Simplify US Equity PLUS QIS ETF
EBLU,Ecofin Global Water ESG Fund
RORO,ATAC US Rotation ETF
SXQG,ETC 6 Meridian Quality Growth ETF
PBMR,PGIM US Large-Cap Buffer 20 ETF - March
URAA,Direxion Daily Uranium Industry Bull 2X Shares
FLGR,Franklin FTSE Germany ETF
DIVS,SmartETFs Dividend Builder ETF
PSIL,AdvisorShares Psychedelics ETF
IPDP,Dividend Performers ETF
SIXP,AllianzIM US LargeCap 6 Month Buffer10 Mar/Sep ETF
PHYD,Putnam ESG High Yield ETF
SPWO,SP Funds S&P World (ex-US) ETF
SDFI,AB Short Duration Income ETF
CNBS,Amplify Seymour Cannabis ETF
RISN,Inspire Tactical Balanced ETF
KFVG,KraneShares CICC China 5G & Semiconductor Idx ETF
BNDD,Quadratic Deflation ETF
RBLD,First Trust Alerian US NextGen Infrastructure ETF
TSLP,Kurv Yield Premium Strategy Tesla TSLA ETF
DBEZ,Xtrackers MSCI Eurozone Hedged Eqty ETF
SBB,ProShares Short SmallCap600
UJUN,Innovator US Equity Ultra Buffer ETF - June
FRNW,Fidelity Clean Energy ETF
HYRM,Xtrackers Risk Managed USD High Yield Strategy ETF
SNPG,Xtrackers S&P 500 Growth ESG ETF
JULP,PGIM US Large Cap Buffer 12 ETF - July
BAUG,Innovator US Equity Buffer ETF - August
GMET,VanEck Green Metals ETF
PJIO,PGIM Jennison International Opportunities ETF
CZAR,Themes Natural Monopoly ETF
USVN,US Treasury 7 Year Note ETF
DEMZ,Democratic Large Cap Core ETF
BUYZ,Franklin Disruptive Commerce ETF
FLHK,Franklin FTSE Hong Kong ETF
OCIO,ClearShares OCIO ETF
WOMN,Impact Shares YWCA Womens Empowerment ETF
COAL,Range Global Coal Index ETF
NJUN,Innovator Growth-100 Power Buffer ETF - June
EQRR,ProShares Equities for Rising Rates ETF
PSCD,Invesco S&P SmallCap Cnsmr Discretionary ETF
BDGS,Bridges Capital Tactical ETF
JANZ,TrueShares Structured Outcome (January) ETF
AVSD,Avantis Responsible International Equity ETF
XJUL,FT Vest US Equity Enh & Mod Buffer ETF - Jul
SFEB,FT Vest US Small Cp Moderate Buffer ETF - Feb
EVX,VanEck Environmental Services ETF
FLSW,Franklin FTSE Switzerland ETF
MDLV,Morgan Dempsey Large Cap Value ETF
TSEC,Touchstone Securitized Income ETF
IBIB,iShares iBonds Oct 2025 Term TIPS ETF
BTEC,Principal Healthcare Innovators ETF
ROMO,Newfound/ReSolve Robust Momentum ETF
BGLD,FT Vest Gold Strategy Quarterly Buffer ETF
AVSE,Avantis Responsible Emerging Markets Equity ETF
BAMO,Brookstone Opportunities ETF
XNOV,FT Vest US Equity Enh & Mod Buffer ETF - Nov
MIG,VanEck Moody's Analytics IG Corporate Bond ETF
BEMB,iShares JPMorgan Broad USD Emerging Mkts Bd ETF
MVFD,Monarch Volume Factor Dividend Tree Index ETF
RNSC,First Trust Small Cap US Equity Select ETF
GLOF,iShares Global Equity Factor ETF
APRH,Innovator Premium Income 20 Barrier ETF - April
TOLL,Tema Monopolies and Oligopolies ETF
JULD,Innovator Premium Income 10 Barrier ETF - July
BAMY,Brookstone Yield ETF
ALAI,Alger AI Enablers & Adopters ETF
SUPP,TCW Transform Supply Chain ETF
EEV,ProShares UltraShort MSCI Emerging Markets
YXI,ProShares Short FTSE China 50
BLDG,Cambria Global Real Estate ETF
PIT,VanEck Commodity Strategy ETF
ARLU,Allianzim US Equity Buffer15 Uncapped Apr ETF
URAX,Defiance Daily Target 2X Long Uranium ETF
HIDE,Alpha Architect High Inflation and Deflation ETF
DEEF,Xtrackers FTSE Developed ex US Multifactor ETF
REVS,Columbia Research Enhanced Value ETF
TAGS,Teucrium Agricultural Fund
TWIO,Trajan Wealth Income Opportunities ETF
XDSQ,Innovator US Equity Accelerated ETF - Quarterly
MEM,Matthews Emerging Markets Equity Active ETF
PPIE,Putnam PanAgora ESG International Equity ETF
JPSV,JPMorgan Active Small Cap Value ETF
NFLP,Kurv Yield Premium Strategy Netflix NFLX ETF
CARK,CastleArk Large Growth ETF
QMID,WisdomTree US MidCap Quality Growth Fund
USRD,Themes US R&D Champions ETF
CSD,Invesco S&P Spin-Off ETF
EFNL,Ishares Msci Finland Etf
HDAW,Xtrackers MSCI AW x US HD Yld Eq ETF
OCTT,AllianzIM US Large Cap Buffer10 Oct ETF
ION,ProShares S&P Global Core Battery Metals ETF
BLCV,BlackRock Large Cap Value ETF
FFLS,Future Fund Long/Short ETF
JULJ,Innovator Premium Income 30 Barrier ETF - July
DRUP,GraniteShares Nasdaq Select Disruptors ETF
AAPR,Innovator Eqty Defined Protctn ETF 2 Y to Apr 2026
RBUF,Innovator U.S. Small Cap 10 Buffer ETF - Quarterly
PSET,Principal Quality ETF
GFGF,Guru Favorite Stocks ETF
AFLG,First Trust Active Factor Large Cap ETF
RZG,Invesco S&P SmallCap 600 Pure Growth ETF
XB,BondBloxx B Rated USD High Yield Corp Bd ETF
DIEM,Franklin Emerging Market Core Dividend Tilt Ix ETF
FDTB,Foundations Dynamic Income ETF
ITDD,iShares LifePath Target Date 2040 ETF
RNEM,First Trust Emerging Markets Equity Select ETF
ADFI,Anfield Dynamic Fixed Income ETF
WTRE,WisdomTree New Economy Real Estate Fund
WEEL,Peerless Option Income Wheel ETF
EZJ,ProShares Ultra MSCI Japan
GAA,Cambria Global Asset Allocation ETF
IVRA,Invesco Real Assets ESG ETF
JULQ,Innovator Premium Income 40 Barrier ETF - July
FTHF,First Trust Emerging Markets Human Flourishing ETF
CCSB,Carbon Collective Short Duration Green Bond ETF
IBTP,iShares iBonds Dec 2034 Term Treasury ETF
GYLD,Arrow Dow Jones Global Yield ETF
AOTG,AOT Growth and Innovation ETF
EMTY,Proshares Decline Of The Retail Store ETF
ONEO,SPDR Russell 1000 Momentum Focus ETF
BKGI,BNY Mellon Global Infrastructure Income ETF
TYLD,Cambria Tactical Yield ETF
NXTI,Simplify Next Intangible Core Index ETF
NXTV,Simplify Next Intangible Value Index ETF
HELX,Franklin Genomic Advancements ETF
TTAI,FCF International Quality ETF
XYLG,Global X S&P 500 Covered Call & Growth ETF
RUFF,Alpha Dog ETF
CPII,Ionic Inflation Protection ETF
BAMA,Brookstone Active ETF
EBIT,Harbor AlphaEdge Small Cap Earners ETF
IHYF,Invesco High Yield Bond Factor ETF
ACSI,American Customer Satisfaction ETF
SDD,ProShares UltraShort SmallCap600
IWFH,iShares Virtual Work and Life Multisector ETF
FPRO,Fidelity Real Estate Investment ETF
MARZ,TrueShares Structured Outcome (March) ETF
NOVZ,TrueShares Structured Outcome (November) ETF
HFGO,Hartford Large Cap Growth ETF
ISDB,Invesco Short Duration Bond ETF
ITDB,iShares LifePath Target Date 2030 ETF
CGUI,Capital Group Ultra Short Income ETF
CTEC,Global X CleanTech ETF
FLAX,Franklin FTSE Asia ex Japan ETF
XDQQ,Innovator Growth Accelerated ETF - Quarterly
GUSA,Goldman Sachs MarketBeta US 1000 Equity ETF
IBIC,iShares iBonds Oct 2026 Term TIPS ETF
XRLX,FundX Conservative ETF
DFND,Siren DIVCON Dividend Defender ETF
EWO,Ishares Msci Austria ETF
JCTR,JPMorgan Carbon Transition US Equity ETF
SIHY,Harbor Scientific Alpha High-Yield ETF
SNPV,Xtrackers S&P 500 Value ESG ETF
GGM,GGM Macro Alignment ETF
CGRO,CoreValues Alpha Greater China Growth ETF
OCTP,PGIM US Large-Cap Buffer 12 ETF - October
OVM,Overlay Shares Municipal Bond ETF
THY,Toews Agility Shares Dynamic Tactical Income ETF
UNOV,Innovator US Equity Ultra Buffer ETF - November
MBSD,FlexShares Disciplined Duration MBS Index Fund
DAT,ProShares Big Data Refiners ETF
HAUS,Residential REIT ETF
BTOP,Bitwise Bitcoin and Ether Equal Weight Strat ETF
OCTQ,Innovator Premium Income 40 Barrier ETF - October
SMCF,Themes US Small Cap Cash Flow Champions ETF
IBGA,iShares iBonds Dec 2044 Term Treasury ETF
EMSG,Xtrackers MSCI Emerging Markets ESG Leaders Equity
EAOM,iShares ESG Aware Moderate Allocation ETF
CBLS,Clough Hedged Equity ETF
PSMR,Pacer Swan SOS Moderate (April) ETF
XTOC,Innovator US Equity Accelerated Plus ETF - October
MPAY,Akros Monthly Payout ETF
PFI,Invesco Dorsey Wright Financial Momentum ETF
MOOD,Relative Sentiment Tactical Allocation ETF
BRHY,BlackRock High Yield Bond ETF
RHTX,RH Tactical Outlook ETF
CVRT,Calamos Convertible Equity Alternative ETF
GOOP,Kurv Yield Premium Strategy Google GOOGL ETF
ARKY,ARK 21Shares Active Bitcoin Ethereum Strategy ETF
RJMG,FT Raymond James Multicap Growth Equity ETF
THNR,Amplify Weight Loss Drug & Treatment ETF
QQQA,ProShares Nasdaq-100 Dorsey Wright Momentum ETF
SPXV,ProShares S&P 500 Ex-Health Care ETF
BCIM,abrdn Bloomberg Industrial Metals Strat K-1 Fr ETF
LSGR,Natixis Loomis Sayles Focused Growth ETF
FLJJ,AllianzIM US Equity 6 Month Floor5 Jan/Jul ETF
CSA,VictoryShares US Small Cap Volatility Wtd Idx ETF
QAT,iShares MSCI Qatar ETF
CHPS,Xtrackers Semiconductor Select Equity ETF
AUMI,Themes Gold Miners ETF
ASHS,Xtrackers Hvst CSI500 China A-Shs SC ETF
BSEP,Innovator US Equity Buffer ETF - September
GDOC,Goldman Sachs Future Health Care Equity ETF
BMVP,Invesco Bloomberg MVP Multi-Factor ETF
XXCH,Direxion Daily MSCI Emerging Mkts ex China Bull 2X
JADE,JPMorgan Active Developing Markets Equity ETF
AIRL,Themes Airlines ETF
MFLX,First Trust Flexible Municipal High Income ETF
AFIF,Anfield Universal Fixed Income ETF
SIXS,ETC 6 Meridian Small Cap Equity ETF
UPV,ProShares Ultra FTSE Europe
WBIG,WBI BullBear Yield 3000 ETF
JSTC,Adasina Social Justice All Cap Global ETF
KSTR,KraneShares SSE STAR Market 50 Index ETF
QCON,American Century Quality Convertible Securities
MJUS,Amplify U.S. Alternative Harvest ETF
UPAR,UPAR Ultra Risk Parity ETF
TUSI,Touchstone Ultra Short Income ETF
LNGG,Roundhill Alerian LNG ETF
FFLV,Fidelity Fundamental Large Cap Value ETF
IBUF,Innovator Intl Developed 10 Buffer ETF - Quarterly
TRES,Defiance Treasury Alternative Yield ETF
UTRE,US Treasury 3 Year Note ETF
IVEG,iShares Emergent Food and AgTech Multisector ETF
RAYS,Global X Solar ETF
FLSA,Franklin FTSE Saudi Arabia ETF
OEUR,ALPS O'Shares Europe Quality Dividend ETF
RDOG,ALPS REIT Dividend Dogs ETF
SPXE,ProShares S&P 500 Ex-Energy ETF
ITAN,Sparkline Intangible Value ETF
WBAT,WisdomTree Battery Value Chain and Innovation Fund
SPCZ,RiverNorth Enhanced Pre-Merger SPAC ETF
EVHY,Eaton Vance High Yield ETF
MYLD,Cambria Micro And SmallCap Shareholder Yield ETF
RVER,Trenchless Fund ETF
QSIG,WisdomTree US Short-Term Corporate Bond Fund
CBON,VanEck China Bond ETF
MAGA,Point Bridge America First ETF
SSPY,Syntax Stratified LargeCap ETF
BMED,BlackRock Future Health ETF
BEDZ,AdvisorShares Hotel ETF
TOTR,T Rowe Price Total Return ETF
SAGP,Strategas Global Policy Opportunities ETF
TILL,Teucrium Agricultural Strategy No K-1 ETF
BBLB,JPMorgan BetaBuilders US Treasury Bond 20+ Yr ETF
PUI,Invesco Dorsey Wright Utilities Momentum ETF
SMCO,Hilton Small-MidCap Opportunity ETF
WEEI,Westwood Salient Enhanced Energy Income ETF
SHAG,WisdomTree Yield Enhanced US Sh-Tr Aggregate Bond
WBIL,WBI BullBear Quality 3000 ETF
MBND,SPDR Nuveen Municipal Bond ETF
XTAP,Innovator US Equity Accelerated Plus ETF - April
QVML,Invesco S&P 500 QVM Multi-factor ETF
BTHM,BlackRock Future US Themes ETF
RSEE,Rareview Systematic Equity ETF
BCDF,Horizon Kinetics Blockchain Development ETF
XJAN,FT Vest US Equity Enh & Mod Buffer ETF - Jan
GOLY,Strategy Shares Gold-Hedged Bond ETF
SAMM,Strategas Macro Momentum ETF
LRND,IQ US Large Cap R&D Leaders ETF
ROKT,SPDR S&P Kensho Final Frontiers ETF
XRLV,Invesco S&P 500 ex-Rate Sensitive LV ETF
FSST,Fidelity Sustainable US Equity ETF
FFND,Future Fund Active ETF
XUSP,Innovator Uncapped Accelerated US Equity ETF
SPDG,SPDR Portfolio S&P Sector Neutral Dividend ETF
KNGS,Roundhill S&P Dividend Monarchs ETF
PCIG,Polen Capital International Growth ETF
FSZ,First Trust Switzerland AlphaDEX Fund
FPXE,First Trust IPOX Europe Equity Opportunities ETF
UCYB,ProShares Ultra Nasdaq Cybersecurity
LGRO,Level Four Large Cap Growth Active ETF
OVB,Overlay Shares Core Bond ETF
RHRX,RH Tactical Rotation ETF
BYRE,Principal Real Estate Active Opportunities ETF
TSLH,Innovator Hedged TSLA Strategy ETF
ADPV,Adaptiv Select ETF
KBUF,KraneShares 90% KWEB Defined Outcome January 2026 ETF
PBJL,PGIM US Large Cap Buffer 20 ETF - July
XMAY,FT Vest US Equity Enh & Mod Buffer ETF - May
ERET,iShares Environmentally Aware Real Estate ETF
MCHS,Matthews China Discovery Active ETF
QSML,WisdomTree US SmallCap Quality Growth Fund
FLDB,Fidelity Low Duration Bond ETF
FDNI,First Trust Dow Jones International Internet ETF
CSF,VictoryShares US Discovery Enh Vol Wtd Idx ETF
RATE,Global X Interest Rate Hedge ETF
FEBT,AllianzIM US Large Cap Buffer10 Feb ETF
FUSI,American Century Multisector Floating Income ETF
IOPP,Simplify Tara India Opportunities ETF
CCSO,Carbon Collective Climate Solutions US Eqty ETF
EAOA,iShares ESG Aware Aggressive Allocation ETF
LFEQ,VanEck Long/Flat Trend ETF
WBIF,WBI BullBear Value 3000 ETF
TXS,Texas Capital Texas Equity Index ETF
NDIA,Global X India Active ETF
USG,USCF Gold Strategy Plus Income Fund
STBF,Performance Trust Short Term Bond ETF
FKU,First Trust United Kingdom AlphaDEX Fund
AQWA,Global X Clean Water ETF
AADR,AdvisorShares Dorsey Wright ADR ETF
ECLN,First Trust EIP Carbon Impact ETF
ROOF,IQ CBRE NextGen Real Estate ETF
SMN,ProShares UltraShort Materials
FMQQ,FMQQ The Next Frontier Internet & Ecommerce ETF
FDHT,Fidelity Digital Health ETF
SAEF,Schwab Ariel ESG ETF
MMCA,IQ MacKay California Municipal Intermediate ETF
EVUS,iShares ESG Aware MSCI USA Value ETF
SURI,Simplify Propel Opportunities ETF
AVNV,Avantis All International Markets Value ETF
CPLS,AB Core Plus Bond ETF
MEMS,Matthews Emerging Markets Discovery Active ETF
QBUF,Innovator Nasdaq-100 10 Buffer ETF - Quarterly
RFFC,ALPS Active Equity Opportunity ETF
SDEM,Global X MSCI SuperDividend Emerging Markets ETF
APRQ,Innovator Premium Income 40 Barrier ETF - April
BDVG,IMGP Berkshire Dividend Growth ETF
OCTD,Innovator Premium Income 10 Barrier ETF - October
DFVE,Doubleline Fortune 500 Equal Weight ETF
XFEB,FT Vest US Equity Enh & Mod Buffer ETF - Feb
LRGG,Macquarie Focused Large Growth ETF
ASMF,Virtus AlphaSimplex Managed Futures ETF
BRF,VanEck Brazil Small-Cap ETF
FEUS,FlexShares ESG & Climate US Large Cap Core Index
SSFI,Day Hagan/Ned Davis Research Smrt Sect Fxd Inc ETF
JANT,AllianzIM US Large Cap Buffer10 Jan ETF
VEMY,Virtus Stone Harbor Emerging Markets HY Bd ETF
IVRS,iShares Future Metaverse Tech & Communications ETF
SEPT,AllianzIM US Large Cap Buffer10 Sep ETF
AAPY,Kurv Yield Premium Strategy Apple AAPL ETF
VSHY,Virtus Newfleet Short Duration High Yield Bond ETF
JANH,Innovator Premium Income 20 Barrier ETF - January
MVPL,Miller Value Partners Leverage ETF
RFEU,First Trust RiverFront Dynamic Europe ETF
IWTR,iShares MSCI Water Management Multisector ETF
CLIX,ProShares Long Online/Short Stores ETF
RFCI,RiverFront Dynamic Core Income ETF
RXD,ProShares UltraShort Health Care ETF
NVBW,AllianzIM US Large Cap Buffer20 Nov ETF
DCMT,Doubleline Commodity Strategy ETF
RTRE,Rareview Total Return Bond ETF
CANQ,Calamos Alternative Nasdaq & Bond ETF
PSCM,Invesco S&P SmallCap Materials ETF
IHY,VanEck International High Yield Bond ETF
RDFI,Rareview Dynamic Fixed Income ETF
OVT,Overlay Shares Short Term Bond ETF
HLGE,Hartford Longevity Economy ETF
PGRO,Putnam Focused Large Cap Growth ETF
YSEP,FT Vest International Equity Buffer ETF - Sep
RSPE,Invesco ESG S&P 500 Equal Weight ETF
VNAM,Global X MSCI Vietnam ETF
IWFG,IQ Winslow Focused Large Cap Growth ETF
DVDN,Kingsbarn Dividend Opportunity ETF
LQAI,LG QRAFT AI-Powered US Large Cap Core ETF
INEQ,Columbia International Equity Income ETF
SKYU,ProShares Ultra Nasdaq Cloud Computing
EVMT,Invesco Electric Vhcl Mtls Cmd Str No K-1 ETF
EFAS,Global X MSCI SuperDividend EAFE ETF
FIXT,Procure Disaster Recovery Strategy ETF
UNIY,WisdomTree Voya Yield Enhanced USD Unvrsl Bd Fund
VMOT,Alpha Architect Value Momentum Trend ETF
DMDV,AAM S&P Developed Markets High Dividend Value ETF
OBOR,KraneShares MSCI One Belt One Road Index ETF
SIMS,SPDR S&P Kensho Intelligent Structures ETF
ULE,ProShares Ultra Euro
LBAY,Leatherback Long/Short Alternative Yield ETF
PSMJ,Pacer Swan SOS Moderate (July) ETF
XDJL,Innovator US Equity Accelerated ETF - July
VERS,ProShares Metaverse ETF
IBIA,iShares iBonds Oct 2024 Term TIPS ETF
INDE,Matthews India Active ETF
DESK,VanEck Office and Commercial REIT ETF
OCTJ,Innovator Premium Income 30 Barrier ETF - October
MDCP,VictoryShares THB Mid Cap ETF
USCL,iShares Climate Conscious & Transtn MSCI USA ETF
ENTR,ERShares Entrepreneurs ETF
SHRY,First Trust Bloomberg Shareholder Yield ETF
TAXE,T Rowe Price Intermediate Municipal Income ETF
AFTY,Pacer CSOP FTSE China A50 ETF
EDOG,ALPS Emerging Sector Dividend Dogs ETF
EWK,Ishares Msci Belgium ETF
GSID,Goldman Sachs MarketBeta International Equity ETF
INMU,BlackRock Intermediate Muni Income Bond ETF
BECO,BlackRock Future Climate and Sust Econ ETF
SMI,VanEck HIP Sustainable Muni ETF
MCH,Matthews China Active ETF
SURE,AdvisorShares Insider Advantage ETF
XNAV,FundX Aggressive ETF
CRED,Columbia Research Enhanced Real Estate ETF
USE,USCF Energy Commodity Strategy Absolute Return Fd
HOCT,Innovator Premium Income 9 Buffer ETF - October
LJAN,Innovator Premium Income 15 Buffer ETF - January
MGRO,VanEck Morningstar Wide Moat Growth ETF
QTR,Global X NASDAQ 100 Tail Risk ETF
TCHI,iShares MSCI China Multisector Tech ETF
NSI,National Security Emerging Markets Index ETF
QOWZ,Invesco Nasdaq Free Cash Flow Achievers ETF
GSIB,Themes Global Systemically Important Banks ETF
QQQN,VictoryShares Nasdaq Next 50 ETF
LDEM,iShares ESG MSCI EM Leaders ETF
FBZ,First Trust Brazil AlphaDEX Fund
ASET,FlexShares Real Assets Allocation Index Fund
CEW,WisdomTree Emerging Currency Strategy Fund
EFU,ProShares UltraShort MSCI EAFE
IQDE,FlexShares International Quality Div Def Idx
ANEW,ProShares MSCI Transformational Changes ETF
QTOC,Innovator Growth Accelerated Plus ETF - October
GFOF,Grayscale Future of Finance ETF
XHYT,BondBloxx USD HY Bond Telecom Med & Tech Sctr ETF
AHOY,Newday Ocean Health ETF
SSXU,Day Hagan/Ned Davis Research Smart Sector Intl ETF
AVDS,Avantis International Small Cap Equity ETF
BGIG,Bahl & Gaynor Income Growth ETF
EMSF,Matthews Emerging Markets Sustainable Ftr Actv ETF
FDVL,Foundations Dynamic Value ETF
STAX,Macquarie Tax-Free USA Short Term ETF
PJBF,PGIM Jennison Better Future ETF
WNDY,Global X Wind Energy ETF
BEEZ,Honeytree US Equity ETF
PSCF,Invesco S&P SmallCap Financials ETF
DYNI,IDX Dynamic Innovation ETF
USSH,WisdomTree 1-3 Year Laddered Treasury Fund
DSTX,Distillate International Fundmntl Stblty & Val ETF
HYUP,Xtrackers High Beta High Yield Bond ETF
HYXU,iShares International High Yield Bond ETF
SIXL,ETC 6 Meridian Low Beta Equity Strategy ETF
UGE,ProShares Ultra Consumer Staples
UBR,ProShares Ultra MSCI Brazil Capped ETF
RTAI,Rareview Tax Advantaged Income ETF
JOJO,ATAC Credit Rotation ETF
EVNT,AltShares Event-Driven ETF
INNO,Harbor Disruptive Innovation ETF
GCLN,Goldman Sachs Bloomberg Clean Energy Equity ETF
IBRN,iShares Neuroscience and Healthcare ETF
DTRE,First Trust Alerian Disruptive Technology Real Est
MEDI,Harbor Health Care ETF
PUTD,Cboe Validus S&P 500 Dynamic PutWrite Index ETF
ARKD,ARK 21Shares Blockchain and Digital Econ Innov ETF
GGUS,Goldman Sachs MarketBeta Russell 1000 Grwth Eq ETF
BTRN,Global X Bitcoin Trend Strategy ETF
GRPZ,Invesco S&P SmallCap 600 GARP ETF
