Symbol,Name
GUNR,FlexShs Morningstar Glbl Upsteam Ntrl Res Idx Fd
FLTW,Franklin FTSE Taiwan ETF
DFUV,DFA Dimensional US Marketwide Value ETF
IYH,iShares US Healthcare ETF
BLOK,Amplify Transformational Data Sharing ETF
IDV,iShares International Select Dividend ETF
IBDR,iShares iBonds Dec 2026 Term Corporate ETF
MUNI,PIMCO Intermediate Municipal Bond Active ETF
EPU,iShares MSCI Peru and Global Exposure ETF
CTA,Simplify Managed Futures Strategy ETF
SBIT,ProShares UltraShort Bitcoin ETF
DWAS,Invesco Dorsey Wright SmallCap Momentum ETF
FELG,Fidelity Enhanced Large Cap Growth ETF
ULST,SPDR SSgA Ultra Short Term Bond ETF
RECS,Columbia Research Enhanced Core ETF
ECH,iShares MSCI Chile ETF
IHE,iShares US Pharmaceuticals ETF
RSPG,Invesco S&P 500 Eql Wght Energy ETF
EETH,ProShares Ether Strategy ETF
XHLF,BondBloxx Bloomberg 6 Mo Tgt Duration US Trsy ETF
XAR,SPDR S&P Aerospace & Defense ETF
FLRT,Pacer Pacific Asset Floating Rate High Income ETF
DFLV,DFA Dimensional US Large Cap Value ETF
BSJQ,Invesco BulletShares 2026 Hi Yld Corp Bd ETF
ISMD,Inspire Small/Mid Cap ETF
XSOE,WisdomTree EM ex-State-Owned Enterprises
PCY,Invesco Emerging Markets Sovereign Debt ETF
EWN,iShares MSCI Netherlands ETF
FLIN,Franklin FTSE India ETF
QDTE,Roundhill N-100 0DTE Covered Call Strategy ETF
AGGY,WisdomTree Yield Enhanced US Aggregate Bond Fund
EZBC,Franklin Bitcoin ETF
IXJ,iShares Global Healthcare ETF
QCLN,First Trust NASDAQ Clean Edge Green Energy Idx Fd
DBMF,iMGP DBi Managed Futures Strategy ETF
CLIP,Global X 1-3 Month T-Bill ETF
TMFC,Motley Fool 100 Index ETF
METU,Direxion Daily META Bull 2X Shares
ISPY,ProShares S&P 500 High Income ETF
PVAL,Putnam Focused Large Cap Value ETF
VRIG,Invesco Variable Rate Investment Grade ETF
GRPM,Invesco S&P MidCap 400 GARP ETF
UTSL,Direxion Daily Utilities Bull 3X Shares
CGBL,Capital Group Core Balanced ETF
WGMI,Valkyrie Bitcoin Miners ETF
RPV,Invesco S&P 500 Pure Value ETF
SPBO,SPDR Portfolio Corporate Bond ETF
VRP,Invesco Variable Rate Preferred ETF
AAPB,GraniteShares 2x Long AAPL Daily ETF
DGCB,Dimensional Global Credit ETF
IMTM,iShares MSCI Intl Momentum Factor ETF
GCOW,Pacer Global Cash Cows Dividend ETF
EAGG,iShares ESG Aware US Aggregate Bond ETF
EWS,Ishares Msci Singapore Etf
LQDW,iShares Investment Grade Corporate Bd BW Strat ETF
JHMM,John Hancock Multifactor Mid Cap ETF
FTGS,First Trust Growth Strength ETF
SDIV,Global X SuperDividend Etf
ACES,ALPS Clean Energy ETF
BSCR,Invesco BulletShares 2027 Corporate Bond ETF
CSM,ProShares Large Cap Core Plus
GTO,Invesco Total Return Bond ETF
DUSB,Dimensional Ultrashort Fixed Income ETF
SMDV,ProShares Russell 2000 Dividend Growers ETF
TDIV,First Trust NASDAQ Technology Dividend Index Fund
DLN,WisdomTree US LargeCap Dividend Fund
SCHC,Schwab International Small-Cap Equity ETF
CGMS,Capital Group US Multi-Sector Inc. ETF
IBDS,iShares iBonds Dec 2027 Term Corporate ETF
USCA,Xtrackers MSCI USA Climate Action Equity ETF
FTRI,First Trust Indxx Global Natural Resources Inc ETF
PDP,Invesco Dorsey Wright Momentum ETF
AMZY,YieldMax AMZN Option Income Strategy ETF
CORP,PIMCO Investment Grade Corporate Bond Index ETF
PYLD,PIMCO Multisector Bond Active ETF
DRV,Direxion Daily Real Estate Bear 3X Shares
IFRA,iShares US Infrastructure ETF
CGSD,Capital Group Short Duration Inc. ETF
FIIG,First Trust Intermediate Duration Invt Gr ETF
SCHQ,Schwab Long-Term US Treasury ETF
CLOZ,Panagram BBB-B CLO ETF
MDYV,SPDR S&P 400 Mid Cap Value ETF
HYGH,iShares Interest Rate Hedged High Yield Bond ETF
HACK,Amplify Cybersecurity ETF
IBHF,iShares iBonds 2026 Term High Yield and Income ETF
IMCG,iShares Morningstar Mid-Cap Growth ETF
CGCB,Capital Group Core Bond ETF
VIOV,Vanguard S&P Small Cap 600 Value ETF
RDVI,FT Vest Rising Dividend Achievers Target Inc
JBBB,Janus Henderson B-BBB CLO ETF
FSIG,First Trust Limited Duration Invt Grd Corp ETF
RETL,Direxion Daily Retail Bull 3X Shares
PSCT,Invesco S&P SmallCap Information Tech ETF
COM,Direxion Auspice Broad Commodity Strategy ETF
DFGR,DFA Dimensional Global Real Estate ETF
IBDT,iShares iBonds Dec 2028 Term Corporate ETF
MDYG,SPDR S&P 400 Mid Cap Growth ETF
FUTY,Fidelity MSCI Utilities Index ETF
AVIG,Avantis Core Fixed Income ETF
HYS,PIMCO 0-5 Year High Yield Corporate Bond Index ETF
VFLO,VictoryShares Free Cash Flow ETF
VCRB,Vanguard Core Bond ETF
PTNQ,Pacer Trendpilot 100 ETF
JIRE,JPMorgan International Research Enhanced Eqty ETF
IBTG,iShares iBonds Dec 2026 Term Treasury ETF
BUFQ,FT Vest Laddered Nasdaq Buffer ETF
QUS,SPDR MSCI USA StrategicFactors ETF
DISV,DFA Dimensional International Small Cap Value ETF
EZA,iShares MSCI South Africa ETF
EWM,iShares MSCI Malaysia ETF
NLR,VanEck Uranium and Nuclear Energy ETF
DBA,Invesco DB Agriculture Fund
PTL,Inspire 500 ETF
ICOW,Pacer Developed Markets International Cash Cws 100
INCO,Columbia India Consumer ETF
CSHI,NEOS Enhanced Income 1-3 Month T-Bill ETF
EUSA,iShares MSCI USA Equal Weighted ETF
AMDY,YieldMax AMD Option Income Strategy ETF
TPHD,Timothy Plan High Dividend Stock ETF
IAI,iShares US Broker-Dealers & Securities Exch ETF
FLCA,Franklin FTSE Canada ETF
FCG,First Trust Natural Gas ETF
VFMO,Vanguard US Momentum Factor ETF
MEAR,BlackRock Short Maturity Municipal Bond ETF
FMB,First Trust Managed Municipal Etf
WCLD,WisdomTree Cloud Computing Fund
IBDU,iShares iBonds Dec 2029 Term Corporate ETF
XT,iShares Exponential Technologies ETF
VTEI,Vanguard Intermediate-Term Tax-Exempt Bond ETF
CURE,Direxion Daily Healthcare Bull 3X Shares
FTC,First Trust Large Cap Growth AlphaDEX Fund
PICK,iShares MSCI Global Metals & Mining Producers ETF
SPUS,SP Funds S&P 500 Sharia Industry Exclusions ETF
IVOO,Vanguard S&P Mid-Cap 400 Index Fund;ETF
SFY,SoFi Select 500 ETF
EWD,Ishares Msci Sweden Etf
PALC,Pacer Lunt Large Cap Multi-Factor Alternator ETF
IWX,iShares Russell Top 200 Value ETF
KOMP,SPDR S&P Kensho New Economies Composite ETF
PFFA,Virtus InfraCap US Preferred Stock ETF
ERY,Direxion Daily Energy Bear 2x Shares
BSCT,Invesco BulletShares 2029 Corporate Bond ETF
HIBS,Direxion Daily S&P 500 High Beta Bear 3X Shares
ARKQ,ARK Autonomous Technology & Robotics ETF
IYC,iShares US Consumer Discretionary ETF
DBO,Invesco DB Oil Fund
NANC,Unusual Whales Subversive Democratic Trading ETF
BUG,Global X Cybersecurity ETF
LVHI,Franklin Intl Low Volatility High Dividend Index
HYDB,iShares High Yield Systematic Bond ETF
JAVA,JPMorgan Active Value ETF
CLOI,VanEck CLO ETF
EYLD,Cambria Emerging Shareholder Yield Etf
ITM,VanEck Intermediate Muni ETF
MSOX,AdvisorShares MSOS 2x Daily ETF
BRRR,Valkyrie Bitcoin Fund
IYY,iShares Dow Jones US ETF
FLMX,Franklin FTSE Mexico ETF
UTWO,US Treasury 2 Year Note ETF
IVOL,Quadratic Interest Rate Vltly and Infltn Hdg ETF
CPER,United States Copper Index Fund
XSHQ,Invesco S&P SmallCap Quality ETF
GSEW,Goldman Sachs Equal Weight Us Large Cap Equity ETF
XSVM,Invesco S and P SmallCap Value with Momentum ETF
FNCL,Fidelity MSCI Financials Index ETF
FV,First Trust Dorsey Wright Focus 5 ETF
FNDC,Schwab Fundamental Intl Small Equity ETF
PAPR,Innovator US Equity Power Buffer ETF - April
ICF,iShares Cohen & Steers REIT ETF
FREL,Fidelity MSCI Real Estate Index ETF
AOA,iShares Core Aggressive Allocation ETF
BABX,GraniteShares 2x Long BABA Daily ETF
EWP,Ishares Msci Spain ETF
ROE,Astoria US Equal Weight Quality Kings ETF
FLCB,Franklin US Core Bond ETF
LRGC,AB US Large Cap Strategic Equities ETF
HYGV,FlexShares High Yield Value-Scored Bond Index Fund
AOM,iShares Core Moderate Allocation ETF
IDMO,Invesco S&P Intl Developed Momentum ETF
REMX,VanEck Rare Earth and Strategic Metals ETF
MEXX,Direxion Daily MSCI Mexico Bull 3X Shares
SUSA,iShares MSCI USA ESG Select ETF
LRGF,iShares US Equity Factor ETF
PSI,Invesco Semiconductors ETF
IAK,iShares US Insurance ETF
AAPD,Direxion Daily AAPL Bear 1X Shares
HTRB,Hartford Total Return Bond ETF
UTEN,US Treasury 10 Year Note ETF
RWJ,Invesco S&P SmallCap 600 Revenue ETF
ZALT,Innovator US Equity 10 Buffer ETF - Quarterly
SMTH,ALPS Smith Core Plus Bond ETF
KLIP,KraneShares Chn Intrnt & Cvrd Cll Strtgy ETF
TARK,Tradr 2X Long Innovation ETF
NULG,Nuveen ESG Large-Cap Growth ETF
TBJL,Innovator 20+ Year Treasury Bond 9 Bffr ETF - Jul
SCHY,Schwab International Dividend Equity ETF
NULV,Nuveen ESG Large-Cap Value ETF
XBIL,US Treasury 6 Month Bill ETF
VTWV,Vanguard Russell 2000 Value Index Fund;ETF
JBND,JPMorgan Active Bond ETF
SECT,Main Sector Rotation ETF
ZJUL,Innovator Equity Defined Protection ETF 1 Yr July
MAXJ,iShares Large Cap Max Buffer Jun ETF
QQQY,Defiance Nasdaq 100 Enhanced Options Income ETF
KMLM,KFA Mount Lucas Managed Futures Index Strategy ETF
DON,WisdomTree US MidCap Dividend Fund
THD,Ishares Msci Thailand Etf
QGRO,American Century US Quality Growth ETF
ROM,ProShares Ultra Technology
GPIQ,Goldman Sachs Nasdaq-100 Core Premium Income ETF
JTEK,JPMorgan US Tech Leaders ETF
SCYB,Schwab High Yield Bond ETF
DFIS,DFA Dimensional International Small Cap ETF
IHF,iShares US Healthcare Providers ETF
FFTY,Innovator IBD 50 ETF
TAFI,AB Tax-Aware Short Duration Municipal ETF
UYLD,Angel Oak UltraShort Income ETF
BSCU,Invesco BulletShares 2030 Corporate Bond ETF
VIOG,Vanguard S&P Small-Cap 600 Growth Index Fund;ETF
MAGX,Roundhill Daily 2X Long Magnificent Seven ETF
FDIS,Fidelity MSCI Consumer Discretionary Index ETF
SUSC,iShares ESG Aware USD Corporate Bond ETF
FENI,Fidelity Enhanced International ETF
EWI,Ishares Msci Italy ETF
IYK,iShares US Consumer Staples ETF
APRW,AllianzIM US Large Cap Buffer20 Apr ETF
BBAG,JPMorgan BetaBuilders US Aggregate Bond ETF
PJAN,Innovator US Equity Power Buffer ETF - January
QQQU,Direxion Daily Concentrated Qs Bull 2X Shares
PEY,Invesco High Yield Equity Dividend Achvrs ETF
LGOV,First Trust Long Duration Opportunities ETF
HLAL,Wahed FTSE USA Shariah ETF
PSK,SPDR ICE Preferred Securities ETF
JMOM,Jpmorgan US Momentum Factor ETF
EQWL,Invesco S and P 100 Equal Weight ETF
ILCG,iShares Morningstar Growth ETF
GNR,SPDR S&P Global Natural Resources ETF
FPEI,First Trust Institutional Prefrrd Sec and Inc ETF
FFLC,Fidelity Fundamental Large Cap Core ETF
ILTB,iShares Core 10+ Year USD Bond ETF
LDUR,PIMCO Enhanced Low Duration Active Exchange-Traded
UTES,Virtus Reaves Utilities ETF
FYLD,Cambria Foreign Shareholder Yield ETF
FTXL,First Trust Nasdaq Semiconductor ETF
INDY,iShares India 50 ETF
IYG,iShares US Financial Services ETF
FBY,YieldMax META Option Income Strategy ETF
BWX,SPDR Bloomberg International Treasury Bond ETF
FLBL,Franklin Senior Loan ETF
BRZU,Direxion Daily MSCI Brazil Bull 2X Shares
FLQM,Franklin US Mid Cap Multifactor Index ETF
DFEN,Direxion Daily Aerospace & Defense Bull 3X Shares
FIDU,Fidelity MSCI Industrials Index ETF
BSCV,Invesco BulletShares 2031 Corporate Bond ETF
IBTH,iShares iBonds Dec 2027 Term Treasury ETF
DES,WisdomTree US SmallCap Dividend Fund
PRFZ,Invesco FTSE RAFI US 1500 Small Mid ETF
KORU,Direxion Daily MSCI South Korea Bull 3X Shares
BIBL,Inspire 100 ETF
METV,Roundhill Ball Metaverse ETF
BSJO,Invesco BulletShares 2024 Hi Yld Corp Bd ETF
BUFB,Innovator Laddered Allocation Buffer ETF
AVSC,Avantis US Small Cap Equity ETF
BUFG,FT Vest Buffered Allocation Growth ETF
ICLO,Invesco AAA CLO Floating Rate Note ETF
COMT,iShares GSCI Commodity Dynamic Roll Strategy ETF
XDTE,Roundhill S&P 500 0DTE Covered Call Strategy ETF
CHAT,Roundhill Generative AI & Technology ETF
FDLO,Fidelity Low Volatility Factor ETF
FEX,First Trust Large Cap Core AlphaDEX Fund
CLOU,Global X Cloud Computing ETF
KAPR,Innovator US Small Cap Power Buffer ETF - April
XHE,SPDR S&P Health Care Equipment ETF
HIBL,Direxion Daily S&P 500 High Beta Bull 3X Shares
TBF,ProShares Short 20+ Yr Treasury
RWO,SPDR Dow Jones Global Real Estate ETF
SFLR,Innovator Equity Managed Floor ETF
AGGH,Simplify Aggregate Bond ETF
VTHR,Vanguard Russell 3000 Index Fund;ETF
CGDG,Capital Group Dividend Growers ETF
QFLR,Innovator Nasdaq-100 Managed Floor ETF
EMLP,First Trust North American Energy Infrastructure
MLN,VanEck Long Muni ETF
QGRW,WisdomTree US Quality Growth Fund
SYFI,AB Short Duration High Yield ETF
USDU,WisdomTree Bloomberg US Dollar Bullish Fund
SEIX,Virtus Seix Senior Loan ETF
IHAK,iShares Cybersecurity and Tech ETF
FCOM,Fidelity MSCI Communication Services Index ETF
IVOG,Vanguard S&P Mid-Cap 400 Growth Index Fund;ETF
TMSL,T Rowe Price Small-Mid Cap ETF
IRBO,iShares Robotics and Artificial Intel Mltsctr ETF
FDLS,Inspire Fidelis Multi Factor ETF
PAAA,PGIM AAA CLO ETF
DFGP,Dimensional Global Core Plus Fixed Income ETF
FLMI,Franklin Dynamic Municipal Bond ETF
FLDR,Fidelity Low Duration Bond Factor ETF
DIVI,Franklin International Core Dividend Tilt Idx ETF
BUFD,FT Vest Laddered Deep Buffer ETF
IYJ,iShares US Industrials ETF
IEZ,iShares US Oil Equipment & Services ETF
FMDE,Fidelity Enhanced Mid Cap ETF
FSTA,Fidelity MSCI Consumer Staples Index ETF
UITB,VictoryShares Core Intermediate Bond ETF
DFAR,DFA Dimensional US Real Estate ETF
IGE,iShares North American Natural Resources ETF
XES,SPDR S&P Oil & Gas Equipment & Services ETF
CWI,SPDR MSCI ACWI ex-US ETF
SUSB,iShares ESG Aware 1-5 Year USD Corporate Bond ETF
BSCW,Invesco BulletShares 2032 Corporate Bond ETF
YEAR,AB Ultra Short Income ETF
REZ,iShares Residential and Multisector Real Estate
BKLC,BNY Mellon US Large Cap Core Equity ETF
FXL,First Trust Technology AlphaDEX Fund
PFLD,AAM Low Duration Preferred and Income Sec ETF
SPIP,SPDR Portfolio TIPS ETF
TACK,Fairlead Tactical Sector ETF
BCI,abrdn Bloomberg All Commodity Strat K-1 Free ETF
EBND,SPDR Bloomberg Emerging Markets Local Bond ETF
OZEM,Roundhill GLP 1 And Weight Loss ETF
FBT,First Trust NYSE Arca Biotechnology Index Fund
DIV,Global X SuperDividend US ETF
NTSX,WisdomTree US Efficient Core Fund
BSCX,Invesco BulletShares 2033 Corporate Bond ETF
TUR,iShares MSCI Turkey ETF
IGPT,Invesco AI and Next Gen Software ETF
FVAL,Fidelity Value Factor ETF
SUSL,iShares ESG MSCI USA Leaders ETF
QJUN,FT Vest Nasdaq-100 Buffer ETF - June
GSST,Goldman Sachs Access Ultra Short Bond ETF
MMIT,IQ MacKay Municipal Intermediate ETF
FMAT,Fidelity MSCI Materials Index ETF
IBDV,iShares iBonds Dec 2030 Term Corporate ETF
PNOV,Innovator US Equity Power Buffer ETF - November
GQRE,FlexShares Global Quality Real Estate Index Fund
DMBS,DoubleLine Mortgage ETF
KCCA,KraneShares California Carbon Allowance Strat ETF
FEMB,First Trust Emerging Markets Local Currency Bd ETF
IWMI,NEOS Russell 2000 High Income ETF
ACIO,Aptus Collared Investment Opportunity ETF
BTAL,AGF US Market Neutral Anti Beta Fund
ALTL,Pacer Lunt Large Cap Alternator ETF
FSMD,Fidelity Small-Mid Multifactor ETF
PMAY,Innovator US Equity Power Buffer ETF - May
YBIT,YieldMax Bitcoin Option Income Strategy ETF
PAUG,Innovator US Equity Power Buffer ETF - August
DFEV,DFA Dimensional Emerging Markets Value ETF
SMLF,iShares US Small-Cap Equity Factor ETF
CORN,Teucrium Corn Fund
SMMD,iShares Russell 2500 ETF
RWK,Invesco S&P MidCap 400 Revenue ETF
PJUN,Innovator US Equity Power Buffer ETF - June
GJUL,FT Vest US Equity Moderate Buffer ETF - Jul
DIVB,iShares Core Dividend ETF
QQQS,Invesco NASDAQ Future Gen 200 ETF
JPUS,JPMorgan Diversified Return US Equity ETF
HYEM,VanEck Emerging Markets High Yield Bond ETF
PNQI,Invesco Nasdaq Internet ETF
SMIG,Bahl & Gaynor Small/Mid Cap Income Growth ETF
RING,iShares MSCI Global Gold Miners ETF
IBDX,iShares iBonds Dec 2032 Term Corporate ETF
VCEB,Vanguard ESG US Corporate Bond ETF
HDEF,Xtrackers MSCI EAFE Hi Dv Yld Eq ETF
CGNG,Capital Group New Geography Equity ETF
UJB,ProShares Ultra High Yield
XCEM,Columbia EM Core ex-China ETF
FDIG,Fidelity Crypto Industry and Digital Payments ETF
BAPR,Innovator US Equity Buffer ETF - April
WEBS,Direxion Daily Dow Jones Internet Bear 3X Shares
QTUM,Defiance Quantum ETF
IBHE,iShares iBonds 2025 Term High Yield and Income ETF
IWMY,Defiance R2000 Enhanced Options Income ETF
BIB,ProShares Ultra Nasdaq Biotechnology
VNM,VanEck Vietnam ETF
DSTL,Distillate US Fundamental Stability & Value ETF
WTAI,WisdomTree Artificial Intelligence and Innov Fund
DAPP,VanEck Digital Transformation ETF
YCS,ProShares UltraShort Yen
DUSL,Direxion Daily Industrials Bull 3X Shares
AOK,iShares Core Conservative Allocation ETF
APUE,ActivePassive US Equity ETF
STRV,Strive 500 ETF
HDGE,AdvisorShares Ranger Equity Bear ETF
JHMD,John Hancock Multifactor Developed Internatl ETF
BSVO,EA Bridgeway Omni Small Cap Value ETF
QDPL,Pacer Metaurus US Large Cap Div Multiplier 400 ETF
USXF,iShares ESG Advanced MSCI USA ETF
FXH,First Trust Health Care AlphaDEX Fund
REGL,ProShares S&P MidCap 400 Dividend Aristocrats ETF
FELV,Fidelity Enhanced Large Cap Value ETF
HCMT,Direxion HCM Tactical Enhanced US Equity Strat ETF
QAI,IQ Hedge Multi-Strategy Tracker ETF
IBDW,iShares iBonds Dec 2031 Term Corporate ETF
FIW,First Trust Water ETF
BKAG,BNY Mellon Core Bond ETF
URNJ,Sprott Junior Uranium Miners ETF
FIGB,Fidelity Investment Grade Bond ETF
YCL,ProShares Ultra Yen
RZV,Invesco S&P SmallCap 600 Pure Value ETF
RSSL,Global X Russell 2000 ETF
NYF,iShares New York Muni Bond ETF
INFL,Horizon Kinetics Inflation Beneficiaries ETF
VTES,Vanguard Short-Term Tax-Exempt Bond ETF
FIVG,Defiance Next Gen Connectivity ETF
EQAL,Invesco Russell 1000 Equal Weight ETF
SCJ,iShares MSCI Japan Small-Cap ETF
BYLD,iShares Yield Optimized Bond ETF
APLY,YieldMax AAPL Option Income Strategy ETF
NBSD,Neuberger Berman Short Duration Income ETF
DFSU,Dimensional US Sustainability Core 1 ETF
VPLS,Vanguard Core-Plus Bond ETF
PGF,Invesco Financial Preferred ETF
BBHY,JPMorgan BetaBuilders USD High Yield Corp Bd ETF
GEM,Goldman Sachs ActiveBeta Em Mkts Equity ETF
RSST,Return Stacked US Stocks & Managed Futures ETF
EDIV,SPDR S&P Emerging Markets Dividend ETF
COWG,Pacer US Large Cap Cash Cows Growth Leaders ETF
NJUL,Innovator Growth-100 Power Buffer ETF - July
CLOA,BlackRock AAA CLO ETF
EIS,Ishares Msci Israel ETF
UTWY,US Treasury 20 Year Bond ETF
PBDC,Putnam BDC Income ETF
FINX,Global X FinTech ETF
UYG,ProShares Ultra Financials
KJUL,Innovator US Small Cap Power Buffer ETF - July
KBWD,Invesco KBW High Dividend Yield Financial ETF
CNYA,Ishares Msci China A Etf
GPIX,Goldman Sachs S&P 500 Core Premium Income ETF
JMEE,JPMorgan Market Expansion Enhanced Equity ETF
SMMV,iShares MSCI USA Small-Cap Min Vol Factor ETF
AMZZ,GraniteShares 2x Long AMZN Daily ETF
DRSK,Aptus Defined Risk ETF
FESM,Fidelity Enhanced Small Cap ETF
TDTT,FlexShares iBoxx 3-Year Target Duration TIPS Index
GJUN,FT Vest US Equity Moderate Buffer ETF - Jun
ESGG,FlexShares STOXX Global ESG Select Index Fund
EPS,WisdomTree US LargeCap Fund
DHS,WisdomTree US High Dividend Fund
YYY,Amplify High Income ETF
MMIN,IQ MacKay Municipal Insured ETF
VBND,Vident US Bond Strategy ETF
OUSM,ALPS O'Shares US Small-Cap Quality Dividend ETF
DLS,WisdomTree International SmallCap Dividend Fund
FXR,First Trust Industrials/Producer Drbls AlphaDEX Fd
TBX,ProShares Short 7-10 Year Treasury
DRIV,Global X Autonomous & Electric Vehicles ETF
BALT,Innovator Defined Wealth Shield ETF
PWV,Invesco Large Cap Value ETF
TPOR,Direxion Daily Transportation Bull 3X Shares
PSFF,Pacer Swan SOS Fund of Funds ETF
YLD,Principal Active High Yield ETF
QWLD,SPDR MSCI World StrategicFactors ETF
UBND,VictoryShares Core Plus Int Bd ETF
BUFC,AB Conservative Buffer ETF
BUFF,Innovator Laddered Allocation Power Buffer ETF
EPOL,Ishares Msci Poland ETF
BNDW,Vanguard Total World Bond ETF
DIG,ProShares Ultra Energy
MOO,VanEck Agribusiness ETF
BKHY,BNY Mellon High Yield ETF
FLQL,Franklin US Large Cap Multifactor Index ETF
DBND,DoubleLine Opportunistic Bond ETF
NUSC,Nuveen ESG Small-Cap ETF
JUNM,FT Vest US Equity Max Buffer ETF - Jun
SPUU,Direxion Daily S&P 500 Bull 2X Shares
SPYT,Defiance S&P 500 Target Income ETF
GLOV,Goldman Sachs ActiveBeta World Low Vol Plus Equity
FNDB,Schwab Fundamental US Broad Market ETF
EEMS,iShares MSCI Emerging Markets Small-Cap ETF
ROBT,First Trust Nasdaq AI and Robotics ETF
UST,ProShares Ultra 7-10 Year Treasury
PSC,Principal U.S. Small-Cap ETF
POCT,Innovator US Equity Power Buffer ETF - October
FM,iShares MSCI Frontier and Select EM ETF
DGRS,WisdomTree US SmallCap Quality Dividend Growth
LCTU,BlackRock US Carbon Transition Readiness ETF
FTQI,First Trust Nasdaq BuyWrite Income ETF
INDL,Direxion Daily MSCI India Bull 2X Shares
FXO,First Trust Financials AlphaDEX Fund
IQDG,WisdomTree International Quality Dividend Growth
PHB,Invesco Fundamental High Yield Corp Bd ETF
QEFA,SPDR MSCI EAFE StrategicFactors ETF
FJUN,FT Vest US Equity Buffer ETF - June
FYX,First Trust Small Cap Core AlphaDEX Fund
JGLO,JPMorgan Global Select Equity ETF
TSPA,T Rowe Price US Equity Research ETF
AVES,Avantis Emerging Markets Value ETF
MJ,Amplify Alternative Harvest ETF
AMDS,GraniteShares 1x Short AMD Daily ETF
HYGW,iShares High Yield Corporate Bond BW Strat ETF
JPIN,JPMorgan Diversified Return International Eqty ETF
PSEP,Innovator US Equity Power Buffer ETF - September
RSPR,Invesco S&P 500 Equal Weight Real Estate ETF
FMHI,First Trust Municipal High Income ETF
SRS,ProShares UltraShort Real Estate
SHLD,Global X Defense Tech ETF
ISCG,iShares Morningstar Small-Cap Growth ETF
SPEU,SPDR Portfolio Europe ETF
PREF,Principal Spectrum Preferred Securities Active ETF
RSPD,Invesco S&P 500 Eql Wght Con DiscrtN ETF
EVSM,Eaton Vance Short Duration Municipal Income ETF
DFCA,DFA Dimensional California Municipal Bond ETF
SCHJ,Schwab 1-5 Year Corporate Bond ETF
USMC,Principal US Mega-Cap ETF
MSFL,GraniteShares 2x Long MSFT Daily ETF
HYHG,ProShares High Yield-Interest Rate Hedged
RSPF,Invesco S&P 500 Eql Wght Financials ETF
YJUN,FT Vest International Equity Moderate Buffer ETF
EVTR,Eaton Vance Total Return Bond ETF
FWD,AB Disruptors ETF
DJUN,FT Vest US Equity Deep Buffer ETF - June
RUNN,Running Oak Efficient Growth ETF
PFFV,Global X Variable Rate Preferred ETF
QXQ,SGI Enhanced Nasdaq-100 ETF
IBHD,iShares iBonds 2024 Term High Yield and Income ETF
SPSK,SP Funds Dow Jones Global Sukuk ETF
DFNM,DFA Dimensional National Municipal Bond ETF
UTHY,US Treasury 30 Year Bond ETF
VUSE,Vident US Equity Strategy ETF
FXD,First Trust Consumer Discretionary AlphaDEX Fund
MTGP,WisdomTree Mortgage Plus Bond Fund
IBDY,iShares iBonds Dec 2033 Term Corporate ETF
PILL,Direxion Daily Pharmaceutical & Medical Bl 3X Shs
GSSC,Goldman Sachs ActiveBeta US Small Cap Equity ETF
CNRG,SPDR S&P Kensho Clean Power ETF
PWZ,Invesco California AMT-Free Municipal Bond ETF
APCB,ActivePassive Core Bond ETF
BCD,abrdn Bloomberg All Cmdty Lngr Dtd Strt K-1 Fr ETF
USTB,VictoryShares Short-Term Bond ETF
USMF,WisdomTree US Multifactor Fund
PTMC,Pacer Trendpilot US Mid Cap ETF
IBTI,iShares iBonds Dec 2028 Term Treasury ETF
QHY,WisdomTree US High Yield Corporate Bond Fund
HGER,Harbor Commodity All-Weather Strategy ETF
OARK,YieldMax Innovation Option Income Strategy ETF
FDHY,Fidelity High Yield Factor ETF
CHAU,Direxion Daily CSI 300 China A Share Bull 2X Shs
SMMU,PIMCO Short Term Municipal Bond Active Exch Tr Fd
VTC,Vanguard Total Corporate Bond ETF
FQAL,Fidelity Quality Factor ETF
FXE,Invesco CurrencyShares Euro Trust
TBUX,T Rowe Price Ultra Short-Term Bond ETF
WANT,Direxion Daily Consumer Discretionary Bull 3X Shs
LONZ,PIMCO Senior Loan Active Exchange-Traded Fund
RODM,Hartford Multifactor Developed Markets (ex-US) ETF
RDIV,Invesco S&P Ultra Dividend Revenue ETF
RFG,Invesco S&P MidCap 400 Pure Growth ETF
FTXN,First Trust NASDAQ Oil & Gas ETF
JAJL,Innovator Equity Defined Protctn ETF 6 Mo Jan/Jul
CDC,VictoryShares US EQ Income Enh Vol Wtd Idx ETF
CDC,VictoryShares US EQ Income Enh Vol Wtd Idx ETF
KBWY,Invesco KBW Premium Yield Equity REIT ETF
ONEY,SPDR Russell 1000 Yield Focus ETF
KXI,iShares Global Consumer Staples ETF
FISR,SPDR SSGA Fixed Income Sector Rotation ETF
HIPS,GraniteShares HIPS US High Income ETF
TDVG,T Rowe Price Dividend Growth ETF
TECB,iShares US Tech Breakthrough Multisector ETF
XTEN,BondBloxx Bloomberg 10 Yr Tgt Duration US Trsy ETF
MVV,ProShares Ultra MidCap400
SLVP,iShares MSCI Global Silver and Metals Miners ETF
GARP,iShares MSCI USA Quality GARP ETF
XNTK,SPDR Nyse Technology ETF
KRBN,KraneShares Global Carbon Strategy ETF
TAXF,American Century Diversified Municipal Bond ETF
SMOT,VanEck Morningstar SMID Moat ETF
EDOW,First Trust Dow 30 Equal Weight ETF
HNDL,Strategy Shares Nasdaq 7HANDL Index ETF
PUTW,WisdomTree PutWrite Strategy Fund
BKIE,BNY Mellon International Equity ETF
EXI,iShares Global Industrials ETF
AVSF,Avantis Short-Term Fixed Income ETF
CEMB,iShares JP Morgan EM Corporate Bond ETF
XSW,SPDR S&P Software & Services ETF
MSFO,YieldMax MSFT Option Income Strategy ETF
EIPI,FT Energy Income Partners Enhanced Income ETF
VFMF,Vanguard US Multifactor Fund;ETF
STOT,SPDR DoubleLine Sht Duration Tot Rtn Tactical ETF
NFTY,First Trust India Nifty 50 Equal Weight ETF
CSB,VictoryShares US SmCp High Div Vol Wtd Idx ETF
SHOC,Strive US Semiconductor ETF
SFLO,VictoryShares Small Cap Free Cash Flow ETF
MFUT,Cambria Chesapeake Pure Trend ETF
PINK,Simplify Health Care ETF
DMXF,iShares ESG Advanced MSCI EAFE ETF
PID,Invesco International Dividend Achievers ETF
FXZ,First Trust Materials AlphaDEX Fund
EFIV,SPDR S And P 500 ESG ETF
PDN,Invesco FTSE RAFI Developed Mkts ex-US SM ETF
PSCI,Invesco S&P SmallCap Industrials ETF
VTEC,Vanguard California Tax-Exempt Bond ETF
PBUS,Invesco MSCI USA ETF
LVHD,Franklin US Low Volatility High Dividend Index
FXC,Invesco CurrencyShares Canadian Dollar Trust
AVGE,Avantis All Equity Markets ETF
TIPX,SPDR Bloomberg 1-10 Year TIPS ETF
FTWO,Strive FAANG 2.0 ETF
CGW,Invesco S&P Global Water Index ETF
JULT,AllianzIM US Large Cap Buffer10 Jul ETF
CPSJ,Calamos S&P 500 Structured Alt Prtctn ETF - July
IUS,Invesco RAFI Strategic US ETF
TSME,Thrivent Small-Mid Cap ESG ETF
CANC,Tema Oncology ETF
HFXI,IQ FTSE International Equity Currency Neutral ETF
DWM,WisdomTree International Equity Fund
FTA,First Trust Large Cap Value AlphaDEX Fund
DFAW,Dimensional World Equity ETF
COPP,Sprott Copper Miners ETF
LQDH,iShares Interest Rate Hedged Corporate Bond ETF
AMID,Argent Mid Cap ETF
TOGA,Tremblant Global ETF
CAOS,Alpha Architect Tail Risk ETF
TDTF,FlexShares iBoxx 5-Year Target Duration TIPS Index
BITQ,Bitwise Crypto Industry Innovators ETF
AVRE,Avantis Real Estate ETF
NETZ,TCW Transform Systems ETF
THTA,SoFi Enhanced Yield ETF
